{
  "valeurs": {
    "Lbleue": "5.2 cm",
    "D": "150 cm",
    "λbleue": "470 nm",
    "Lrouge": "7.8 cm",
    "λrouge": "650 nm"
  },
  "correction": "1.1 Le montage est réalisé en connectant la broche bleue de la DEL RVB à la sortie du microcontrôleur Arduino via une résistance de 200 Ω. La broche commune (la plus longue) est connectée à la masse (GND) de l'Arduino.\n\n1.2 Pour créer l'image de l'ouverture circulaire à l'infini, il faut placer une lentille convergente de distance focale f à une distance égale à f de l'ouverture. Ainsi, les rayons lumineux émergents seront parallèles.\n\n1.3 La lentille convergente est placée à sa distance focale de l'ouverture. L'écran est ensuite placé à l'extrémité du banc optique pour observer l'image.\n\n1.4 Le réseau de diffraction est accolé à la lentille du côté face à l'écran. Les maxima lumineux sont observés de part et d'autre de la tache centrale.\n\n1.5 Les mesures donnent Lbleue = 5.2 cm et D = 150 cm.\n\n1.6 La longueur d'onde λbleue est calculée avec la formule λ = a∙L/D. Avec a = 7.1×10⁻³ mm, L = 5.2 cm et D = 150 cm, on trouve λbleue = 470 nm.\n\n1.7 Pour la lumière rouge, Lrouge = 7.8 cm. En appliquant la même formule, on trouve λrouge = 650 nm.\n\n2.1 Le montage est modifié pour alimenter simultanément les broches rouge et bleue de la DEL.\n\n2.2 La lumière perçue est magenta car c'est le résultat de la synthèse additive des lumières rouge et bleue. Cependant, l'intensité relative des deux couleurs peut affecter la teinte perçue.\n\n2.3 L'ajout d'une résistance de 100 Ω en série avec la broche rouge permet d'équilibrer les intensités lumineuses, améliorant ainsi la qualité de la lumière magenta.\n\n3.1 Les valeurs de λbleue (470 nm) et λrouge (650 nm) sont cohérentes avec le spectre visible (environ 400-700 nm).\n\n3.2 L'ajout de la résistance R2 améliore la couleur restituée en équilibrant les contributions du rouge et du bleu.\n\n3.3 Les cônes R (rouge) sont moins sensibles que les cônes B (bleu) à leurs longueurs d'onde respectives. Augmenter la résistance associée au rouge réduit son intensité, compensant ainsi la différence de sensibilité pour obtenir une lumière magenta équilibrée."
}